/Library/Java/JavaVirtualMachines/jdk1.8.0_05.jdk/Contents/Home/bin/java -Didea.launcher.port=7534 "-Didea.launcher.bin.path=/Applications/IntelliJ IDEA 14.app/Contents/bin" -Dfile.encoding=UTF-8 -classpath "/Library/Java/JavaVirtualMachines/jdk1.8.0_05.jdk/Contents/Home/lib/ant-javafx.jar:/Library/Java/JavaVirtualMachines/jdk1.8.0_05.jdk/Contents/Home/lib/dt.jar:/Library/Java/JavaVirtualMachines/jdk1.8.0_05.jdk/Contents/Home/lib/javafx-mx.jar:/Library/Java/JavaVirtualMachines/jdk1.8.0_05.jdk/Contents/Home/lib/jconsole.jar:/Library/Java/JavaVirtualMachines/jdk1.8.0_05.jdk/Contents/Home/lib/sa-jdi.jar:/Library/Java/JavaVirtualMachines/jdk1.8.0_05.jdk/Contents/Home/lib/tools.jar:/Library/Java/JavaVirtualMachines/jdk1.8.0_05.jdk/Contents/Home/jre/lib/charsets.jar:/Library/Java/JavaVirtualMachines/jdk1.8.0_05.jdk/Contents/Home/jre/lib/deploy.jar:/Library/Java/JavaVirtualMachines/jdk1.8.0_05.jdk/Contents/Home/jre/lib/htmlconverter.jar:/Library/Java/JavaVirtualMachines/jdk1.8.0_05.jdk/Contents/Home/jre/lib/javaws.jar:/Library/Java/JavaVirtualMachines/jdk1.8.0_05.jdk/Contents/Home/jre/lib/jce.jar:/Library/Java/JavaVirtualMachines/jdk1.8.0_05.jdk/Contents/Home/jre/lib/jfr.jar:/Library/Java/JavaVirtualMachines/jdk1.8.0_05.jdk/Contents/Home/jre/lib/jfxswt.jar:/Library/Java/JavaVirtualMachines/jdk1.8.0_05.jdk/Contents/Home/jre/lib/jsse.jar:/Library/Java/JavaVirtualMachines/jdk1.8.0_05.jdk/Contents/Home/jre/lib/management-agent.jar:/Library/Java/JavaVirtualMachines/jdk1.8.0_05.jdk/Contents/Home/jre/lib/plugin.jar:/Library/Java/JavaVirtualMachines/jdk1.8.0_05.jdk/Contents/Home/jre/lib/resources.jar:/Library/Java/JavaVirtualMachines/jdk1.8.0_05.jdk/Contents/Home/jre/lib/rt.jar:/Library/Java/JavaVirtualMachines/jdk1.8.0_05.jdk/Contents/Home/jre/lib/ext/cldrdata.jar:/Library/Java/JavaVirtualMachines/jdk1.8.0_05.jdk/Contents/Home/jre/lib/ext/dnsns.jar:/Library/Java/JavaVirtualMachines/jdk1.8.0_05.jdk/Contents/Home/jre/lib/ext/jfxrt.jar:/Library/Java/JavaVirtualMachines/jdk1.8.0_05.jdk/Contents/Home/jre/lib/ext/localedata.jar:/Library/Java/JavaVirtualMachines/jdk1.8.0_05.jdk/Contents/Home/jre/lib/ext/nashorn.jar:/Library/Java/JavaVirtualMachines/jdk1.8.0_05.jdk/Contents/Home/jre/lib/ext/sunec.jar:/Library/Java/JavaVirtualMachines/jdk1.8.0_05.jdk/Contents/Home/jre/lib/ext/sunjce_provider.jar:/Library/Java/JavaVirtualMachines/jdk1.8.0_05.jdk/Contents/Home/jre/lib/ext/sunpkcs11.jar:/Library/Java/JavaVirtualMachines/jdk1.8.0_05.jdk/Contents/Home/jre/lib/ext/zipfs.jar:/Users/dwatkins/dev/repos/projects/sketchbook/cardread/target/classes:/Users/dwatkins/.m2/repository/org/usb4java/usb4java-javax/1.2.0/usb4java-javax-1.2.0.jar:/Users/dwatkins/.m2/repository/javax/usb/usb-api/1.0.2/usb-api-1.0.2.jar:/Users/dwatkins/.m2/repository/org/apache/commons/commons-lang3/3.2.1/commons-lang3-3.2.1.jar:/Users/dwatkins/.m2/repository/org/usb4java/usb4java/1.2.0/usb4java-1.2.0.jar:/Users/dwatkins/.m2/repository/org/usb4java/libusb4java/1.2.0/libusb4java-1.2.0-linux-x86.jar:/Users/dwatkins/.m2/repository/org/usb4java/libusb4java/1.2.0/libusb4java-1.2.0-linux-x86_64.jar:/Users/dwatkins/.m2/repository/org/usb4java/libusb4java/1.2.0/libusb4java-1.2.0-linux-arm.jar:/Users/dwatkins/.m2/repository/org/usb4java/libusb4java/1.2.0/libusb4java-1.2.0-windows-x86.jar:/Users/dwatkins/.m2/repository/org/usb4java/libusb4java/1.2.0/libusb4java-1.2.0-windows-x86_64.jar:/Users/dwatkins/.m2/repository/org/usb4java/libusb4java/1.2.0/libusb4java-1.2.0-osx-x86.jar:/Users/dwatkins/.m2/repository/org/usb4java/libusb4java/1.2.0/libusb4java-1.2.0-osx-x86_64.jar:/Applications/IntelliJ IDEA 14.app/Contents/lib/idea_rt.jar" com.intellij.rt.execution.application.AppMain org.hale.sketchbook.rfid.cardread.DumpDevices
USB Service Implementation: usb4java
Implementation version: 1.2.0
Service API version: 1.0.2

usb4java root hub 1.0.0
Device Descriptor:
  bLength                 18
  bDescriptorType          1
  bcdUSB                1.01
  bDeviceClass             9 Hub
  bDeviceSubClass          0
  bDeviceProtocol          0
  bMaxPacketSize0          8
  idVendor            0xffff
  idProduct           0xffff
  bcdDevice             0.00
  iManufacturer            1
  iProduct                 2
  iSerial                  3
  bNumConfigurations       1

Configuration Descriptor:
  bLength                  9
  bDescriptorType          2
  wTotalLength            18
  bNumInterfaces           1
  bConfigurationValue      1
  iConfiguration           0
  bmAttributes          0x80
    (Bus Powered)
  bMaxPower                0mA

Interface Descriptor:
  bLength                  9
  bDescriptorType          4
  bInterfaceNumber         0
  bAlternateSetting        0
  bNumEndpoints            0
  bInterfaceClass          9 Hub
  bInterfaceSubClass       0
  bInterfaceProtocol       0
  iInterface               0


Bus 020 Device 129: ID 05ac:8007
Connected to port: 1
Parent: usb4java root hub 1.0.0
Device Descriptor:
  bLength                 18
  bDescriptorType          1
  bcdUSB                2.00
  bDeviceClass             9 Hub
  bDeviceSubClass          0
  bDeviceProtocol          1
  bMaxPacketSize0          9
  idVendor            0x05ac
  idProduct           0x8007
  bcdDevice             3.00
  iManufacturer            2
  iProduct                 1
  iSerial                  0
  bNumConfigurations       1

Configuration Descriptor:
  bLength                 10
  bDescriptorType          2
  wTotalLength            33
  bNumInterfaces           1
  bConfigurationValue      1
  iConfiguration           0
  bmAttributes          0x60
    Self Powered
    Remote Wakeup
  bMaxPower                0mA

Interface Descriptor:
  bLength                  9
  bDescriptorType          4
  bInterfaceNumber         0
  bAlternateSetting        0
  bNumEndpoints            1
  bInterfaceClass          9 Hub
  bInterfaceSubClass       0
  bInterfaceProtocol       0
  iInterface               0

Endpoint Descriptor:
  bLength                  8
  bDescriptorType          5
  bEndpointAddress      0x81  EP 1 IN
  bmAttributes            19
    Transfer Type             Interrupt
    Synch Type                None
    Usage Type                Feedback
  wMaxPacketSize           2
  bInterval                9


Bus 020 Device 003: ID 05ac:025a
Connected to port: 1
Parent: Bus 020 Device 129: ID 05ac:8007
Device Descriptor:
  bLength                 18
  bDescriptorType          1
  bcdUSB                2.00
  bDeviceClass             0 Per Interface
  bDeviceSubClass          0
  bDeviceProtocol          0
  bMaxPacketSize0          8
  idVendor            0x05ac
  idProduct           0x025a
  bcdDevice             2.24
  iManufacturer            1
  iProduct                 2
  iSerial                  0
  bNumConfigurations       1

Configuration Descriptor:
  bLength                  9
  bDescriptorType          2
  wTotalLength            84
  bNumInterfaces           3
  bConfigurationValue      1
  iConfiguration           0
  bmAttributes          0xa0
    (Bus Powered)
    Remote Wakeup
  bMaxPower               40mA

Interface Descriptor:
  bLength                  9
  bDescriptorType          4
  bInterfaceNumber         0
  bAlternateSetting        0
  bNumEndpoints            1
  bInterfaceClass          3 HID
  bInterfaceSubClass       1
  bInterfaceProtocol       1
  iInterface               3

Endpoint Descriptor:
  bLength                  7
  bDescriptorType          5
  bEndpointAddress      0x83  EP 3 IN
  bmAttributes             3
    Transfer Type             Interrupt
    Synch Type                None
    Usage Type                Data
  wMaxPacketSize          10
  bInterval                8

Interface Descriptor:
  bLength                  9
  bDescriptorType          4
  bInterfaceNumber         1
  bAlternateSetting        0
  bNumEndpoints            1
  bInterfaceClass          3 HID
  bInterfaceSubClass       0
  bInterfaceProtocol       0
  iInterface               4

Endpoint Descriptor:
  bLength                  7
  bDescriptorType          5
  bEndpointAddress      0x81  EP 1 IN
  bmAttributes             3
    Transfer Type             Interrupt
    Synch Type                None
    Usage Type                Data
  wMaxPacketSize          64
  bInterval                2

Interface Descriptor:
  bLength                  9
  bDescriptorType          4
  bInterfaceNumber         2
  bAlternateSetting        0
  bNumEndpoints            1
  bInterfaceClass          3 HID
  bInterfaceSubClass       1
  bInterfaceProtocol       2
  iInterface               4

Endpoint Descriptor:
  bLength                  7
  bDescriptorType          5
  bEndpointAddress      0x84  EP 4 IN
  bmAttributes             3
    Transfer Type             Interrupt
    Synch Type                None
    Usage Type                Data
  wMaxPacketSize           8
  bInterval                8


Bus 021 Device 128: ID 05ac:8007
Connected to port: 2
Parent: usb4java root hub 1.0.0
Device Descriptor:
  bLength                 18
  bDescriptorType          1
  bcdUSB                3.00
  bDeviceClass             9 Hub
  bDeviceSubClass          0
  bDeviceProtocol          3
  bMaxPacketSize0          9
  idVendor            0x05ac
  idProduct           0x8007
  bcdDevice             3.00
  iManufacturer            2
  iProduct                 1
  iSerial                  0
  bNumConfigurations       1

Configuration Descriptor:
  bLength                 10
  bDescriptorType          2
  wTotalLength            33
  bNumInterfaces           1
  bConfigurationValue      1
  iConfiguration           0
  bmAttributes          0x60
    Self Powered
    Remote Wakeup
  bMaxPower                0mA

Interface Descriptor:
  bLength                  9
  bDescriptorType          4
  bInterfaceNumber         0
  bAlternateSetting        0
  bNumEndpoints            1
  bInterfaceClass          9 Hub
  bInterfaceSubClass       0
  bInterfaceProtocol       0
  iInterface               0

Endpoint Descriptor:
  bLength                  8
  bDescriptorType          5
  bEndpointAddress      0x81  EP 1 IN
  bmAttributes            19
    Transfer Type             Interrupt
    Synch Type                None
    Usage Type                Feedback
  wMaxPacketSize           2
  bInterval                9
